{"date_of_death": "2026-09-22", "death_circumstance": "sudden_unexpected", "death_country": "US",
 "death_state": "FL", "residence_state": "FL", "user_role": "adult_child_executor", "is_veteran": null,
 "has_will": false, "faith_tradition": "muslim", "disposition": "burial", "was_employed": true,
 "citizenship_status": "us_citizen"}
