{"date_of_death": "2026-09-20", "death_circumstance": "expected_home_hospice", "death_country": "US",
 "death_state": "NH", "residence_state": "NH", "user_role": "surviving_spouse", "is_veteran": true,
 "has_will": true, "has_trust": false, "received_ssa_benefits": true, "was_employed": false, "had_employer_plan": true,
 "citizenship_status": "us_citizen", "faith_tradition": "jewish", "disposition": "burial",
 "owned_vehicle": true, "owned_real_estate": true}
