{"date_of_death": "2026-09-18", "death_circumstance": "expected_facility", "death_country": "US",
 "death_state": "NV", "residence_state": "CA", "user_role": "adult_child_executor", "is_veteran": false,
 "has_will": true, "has_trust": true, "received_ssa_benefits": true, "faith_tradition": "none", "disposition": "cremation",
 "owned_vehicle": false, "owned_real_estate": true, "citizenship_status": "us_citizen"}
