{"death_circumstance": "abroad", "death_country": "MX", "death_state": null, "residence_state": "NH",
 "user_role": "adult_child_executor", "citizenship_status": "permanent_resident", "pending_immigration_case": false,
 "faith_tradition": "catholic", "disposition": "burial", "owned_real_estate": true, "is_veteran": false}
